{"schemaVersion":"utility-state/1.0","townId":"town-ab2b8b3609f83517","simulationId":"run-substation_outage-2026-07-15-8139359d34","topologyRevision":"topo-c93bb5c16d5642a31979","indexRevision":"idx-caefbe292ca37422091f","sequence":1140,"simTime":"2026-07-15T23:00:00Z","complete":true,"scenario":"substation_outage","networks":{"electric":{"unit":"kW","edgeIds":["electric-E0","electric-E1","electric-E2","electric-E3","electric-E4","electric-E5","electric-E6","electric-E7","electric-E8","electric-E9","electric-E10","electric-E11","electric-E12","electric-E13","electric-E14","electric-E15","electric-E16","electric-E17","electric-E18","electric-E19","electric-E20","electric-E21","electric-E22","electric-E23","electric-E24","electric-E25","electric-E26","electric-E27","electric-E28","electric-E29","electric-E30","electric-E31","electric-E32","electric-E33","electric-E34","electric-E35","electric-E36","electric-E37","electric-E38","electric-E39","electric-E40","electric-E41","electric-E42","electric-E43","electric-E44","electric-E45","electric-E46","electric-E47","electric-E48","electric-E49","electric-E50","electric-E51","electric-E52","electric-E53","electric-E54","electric-E55","electric-E56","electric-E57","electric-E58","electric-E59","electric-E60","electric-E61","electric-E62","electric-E63","electric-E64","electric-E65","electric-E66","electric-E67","electric-E68","electric-E69","electric-E70","electric-E71","electric-E72","electric-E73","electric-E74","electric-E75","electric-E76","electric-E77","electric-E78","electric-E79","electric-E80","electric-E81","electric-E82","electric-E83","electric-E84","electric-E85","electric-E86","electric-E87","electric-E88","electric-E89","electric-E90","electric-E91","electric-E92","electric-E93","electric-E94","electric-E95","electric-E96","electric-E97","electric-E98","electric-E99","electric-E100","electric-E101","electric-E102","electric-E103","electric-E104","electric-E105","electric-E106","electric-E107","electric-E108","electric-E109","electric-E110","electric-E111","electric-E112","electric-E113","electric-E114","electric-E115","electric-E116","electric-E117","electric-E118","electric-E119","electric-E120","electric-E121","electric-E122","electric-E123","electric-E124","electric-E125","electric-E126","electric-E127","electric-E128","electric-E129","electric-E130","electric-E131","electric-E132","electric-E133","electric-E134","electric-E135","electric-E136","electric-E137","electric-E138","electric-E139","electric-E140","electric-E141","electric-E142","electric-E143","electric-E144","electric-E145","electric-E146","electric-E147","electric-E148","electric-E149","electric-E150","electric-E151","electric-E152","electric-E153","electric-E154","electric-E155","electric-E156","electric-E157","electric-E158","electric-E159","electric-E160","electric-E161","electric-E162","electric-E163","electric-E164","electric-E165","electric-E166","electric-E167","electric-E168","electric-E169","electric-E170","electric-E171","electric-E172","electric-E173","electric-E174","electric-E175","electric-E176","electric-E177","electric-E178","electric-E179","electric-E180","electric-E181","electric-E182","electric-E183","electric-E184","electric-E185","electric-E186","electric-E187","electric-E188","electric-E189","electric-E190","electric-E191","electric-E192","electric-E193","electric-E194","electric-E195","electric-E196","electric-E197","electric-E198","electric-E199","electric-E200","electric-E201","electric-E202","electric-E203","electric-E204","electric-E205","electric-E206","electric-E207","electric-E208","electric-E209","electric-E210","electric-E211","electric-E212","electric-E213","electric-E214","electric-E215","electric-E216","electric-E217","electric-E218","electric-E219","electric-E220","electric-E221","electric-E222","electric-E223","electric-E224","electric-E225","electric-E226","electric-E227","electric-E228","electric-E229","electric-E230","electric-E231","electric-E232","electric-E233","electric-E234","electric-E235","electric-E236","electric-E237","electric-E238","electric-E239","electric-E240","electric-E241","electric-E242","electric-E243","electric-E244","electric-E245","electric-E246","electric-E247","electric-E248","electric-E249","electric-E250","electric-E251","electric-E252","electric-E253","electric-E254","electric-E255","electric-E256","electric-E257","electric-E258","electric-E259","electric-E260","electric-E261","electric-E262","electric-E263","electric-E264","electric-E265","electric-E266","electric-E267","electric-E268","electric-E269","electric-E270","electric-E271","electric-E272","electric-E273","electric-E274","electric-E275","electric-E276","electric-E277","electric-E278","electric-E279","electric-E280","electric-E281","electric-E282","electric-E283","electric-E284","electric-E285","electric-E286","electric-E287","electric-E288","electric-E289","electric-E290","electric-E291","electric-E292","electric-E293","electric-E294","electric-E295","electric-E296","electric-E297","electric-E298","electric-E299","electric-E300","electric-E301","electric-E302","electric-E303","electric-E304","electric-E305","electric-E306","electric-E307","electric-E308","electric-E309","electric-E310","electric-E311","electric-E312","electric-E313","electric-E314","electric-E315","electric-E316","electric-E317","electric-E318","electric-E319","electric-E320","electric-E321","electric-E322","electric-E323","electric-E324","electric-E325","electric-E326","electric-E327","electric-E328","electric-E329","electric-E330","electric-E331","electric-E332","electric-E333","electric-E334","electric-E335","electric-E336","electric-E337","electric-E338","electric-E339","electric-E340","electric-E341","electric-E342","electric-E343","electric-E344","electric-E345","electric-E346","electric-E347","electric-E348","electric-E349","electric-E350","electric-E351","electric-E352","electric-E353","electric-E354","electric-E355","electric-E356","electric-E357","electric-E358","electric-E359","electric-E360","electric-E361","electric-E362","electric-E363","electric-E364","electric-E365","electric-E366","electric-E367","electric-E368","electric-E369","electric-E370","electric-E371","electric-E372","electric-E373","electric-E374","electric-E375","electric-E376","electric-E377","electric-E378","electric-E379","electric-E380","electric-E381","electric-E382","electric-E383","electric-E384","electric-E385","electric-E386","electric-E387","electric-E388","electric-E389","electric-E390","electric-E391","electric-E392","electric-E393","electric-E394","electric-E395","electric-E396","electric-E397","electric-E398","electric-E399","electric-E400","electric-E401","electric-E402","electric-E403","electric-E404","electric-E405","electric-E406","electric-E407","electric-E408","electric-E409","electric-E410","electric-E411","electric-E412","electric-E413","electric-E414","electric-E415","electric-E416","electric-E417","electric-E418","electric-E419","electric-E420","electric-E421","electric-E422","electric-E423","electric-E424","electric-E425","electric-E426","electric-E427","electric-E428","electric-E429","electric-E430","electric-E431","electric-E432","electric-E433","electric-E434","electric-E435","electric-E436","electric-E437","electric-E438","electric-E439","electric-E440","electric-E441","electric-E442","electric-E443","electric-E444","electric-E445","electric-E446","electric-E447","electric-E448","electric-E449","electric-E450","electric-E451","electric-E452","electric-E453","electric-E454","electric-E455","electric-E456","electric-E457","electric-E458","electric-E459","electric-E460","electric-E461","electric-E462","electric-E463","electric-E464","electric-E465","electric-E466","electric-E467","electric-E468","electric-E469","electric-E470","electric-E471","electric-E472","electric-E473","electric-E474","electric-E475","electric-E476","electric-E477","electric-E478","electric-E479","electric-E480","electric-E481","electric-E482","electric-E483","electric-E484","electric-E485","electric-E486","electric-E487","electric-E488","electric-E489","electric-E490","electric-E491","electric-E492","electric-E493","electric-E494","electric-E495","electric-E496","electric-E497","electric-E498","electric-E499","electric-E500","electric-E501","electric-E502","electric-E503","electric-E504","electric-E505","electric-E506","electric-E507","electric-E508","electric-E509","electric-E510","electric-E511","electric-E512","electric-E513","electric-E514","electric-E515","electric-E516","electric-E517","electric-E518","electric-E519","electric-E520","electric-E521","electric-E522","electric-E523","electric-E524","electric-E525","electric-E526","electric-E527","electric-E528","electric-E529","electric-E530","electric-E531","electric-E532","electric-E533","electric-E534","electric-E535","electric-E536","electric-E537","electric-E538","electric-E539","electric-E540","electric-E541","electric-E542","electric-E543","electric-E544","electric-E545","electric-E546","electric-E547","electric-E548","electric-E549","electric-E550","electric-E551","electric-E552","electric-E553","electric-E554","electric-E555","electric-E556","electric-E557","electric-E558","electric-E559","electric-E560","electric-E561","electric-E562","electric-E563","electric-E564","electric-E565","electric-E566","electric-E567","electric-E568","electric-E569","electric-E570","electric-E571","electric-E572","electric-E573","electric-E574","electric-E575","electric-E576","electric-E577","electric-E578","electric-E579","electric-E580","electric-E581","electric-E582","electric-E583","electric-E584","electric-E585","electric-E586","electric-E587","electric-E588","electric-E589","electric-E590","electric-E591","electric-E592","electric-E593","electric-E594","electric-E595","electric-E596","electric-E597","electric-E598","electric-E599","electric-E600","electric-E601","electric-E602","electric-E603","electric-E604","electric-E605","electric-E606","electric-E607","electric-E608","e